{"bundle_id":"sha256:d246e4ba45a149923e6e2ff3e6d63f4a3fa7b885e1eb0349b87a0c22b1c9959b","compatibility":{"canonicalizer_version":"json-canonicalize@3.0.1","configuration_digest":"sha256:9388d770dc2b585a6d637ea0dcb61e5923e8d026f606574d7fff2c83595c566b","external_adapter_versions":{},"external_evaluator_versions":{},"identity_algorithm_version":"1.0.0","parser_version":"evidence-bundle-parser@1.0.0","report_schema_version":"1.0","rule_set_digest":"sha256:0350791c2e89ae65009fca9c642cf41981752c5f188990c30a3d6d46b580385e","target_inventory_digest":"sha256:d2c6ce039cd722d7e6c6a78d6c61bbbbedbb27af069ece8e9b903c9c8499a5bd","toolkit_version":"0.0.0"},"evidence_completeness":{"BUILD":"COMPLETE","EXTERNAL":"NOT_REQUESTED","LIVE":"NOT_REQUESTED","RUNTIME_OBSERVATION":"NOT_REQUESTED","SOURCE":"COMPLETE","TASK_EVALUATION":"NOT_REQUESTED"},"external_evaluations":[],"findings":[{"category":"operational-readiness","deterministic_fact":"Declared source-to-build relation mapping:getting-started references present SOURCE and BUILD evidence.","evidence":[{"evidence_id":"source:getting-started","sha256":"b1466d181438eea69b489cd6f48b0cc494d615e919f0d9deea4b0e588ffd61b6"},{"evidence_id":"build:getting-started","sha256":"e5f5ffe0a7d4a93ad3baacf7c825780cd6a3d7db1fb40ced6dbc5b3448aff8b9"}],"evidence_mode":"BUILD","expected_value":{"build_present":true,"source_present":true},"fingerprint":"sha256:e947fd2ea1b2bcf263b0da0c6eb70d7836166b82cf671ceedcf257493937188b","identity_status":"IDENTITY_ASSERTED","implementation_digest":"sha256:c4cd427070947283dc931be268e60fceb81f01219045ec31ad62c61ee951a4d8","likely_causes":[],"observed_value":{"build_present":true,"mapping_trust":"USER_ASSERTED","source_present":true},"recommended_fix":"No remediation required.","regression_test_suggestion":"Keep this mapping as a source-to-build fixture.","responsible_boundary":null,"rule_id":"DART-OPS-001","rule_version":"1.0.0","severity":"high","status":"PASS","sub_identity":"mapping:getting-started","target":{"identity":"getting-started","kind":"ARTIFACT"},"title":"Explicit source-to-build identity","validation_method":"Recreate the bundle and replay DART-OPS-001."},{"category":"operational-readiness","deterministic_fact":"Evidence integrity, acquisition, provenance, authenticity, and freshness remain distinct.","evidence":[{"evidence_id":"build:getting-started","sha256":"e5f5ffe0a7d4a93ad3baacf7c825780cd6a3d7db1fb40ced6dbc5b3448aff8b9"}],"evidence_mode":"BUILD","expected_value":{"integrity":"MATCHED","provenance_recorded":true},"fingerprint":"sha256:36b8b8af2e763598d840146ddd670107f7bd5ab7531e4f25d5feb62c23614668","identity_status":"IDENTITY_UNVERIFIED","implementation_digest":"sha256:f06bdb2546c95d185d366f9804aa3b62ca917782f590a5f4d776f1242153a8be","likely_causes":[],"observed_value":{"acquisition":"COLLECTED","authenticity":"UNVERIFIED","deployment_trust":null,"freshness":"UNKNOWN","integrity":"MATCHED","provenance":"PRESENT"},"recommended_fix":"No remediation required.","regression_test_suggestion":"Keep asserted and attested provenance fixtures separate.","responsible_boundary":null,"rule_id":"DART-OPS-003","rule_version":"1.0.0","severity":"medium","status":"PASS","sub_identity":"build:getting-started","target":{"identity":"getting-started","kind":"ARTIFACT"},"title":"Evidence provenance and trust","validation_method":"Verify the bundle and inspect trust labels."},{"category":"operational-readiness","deterministic_fact":"Evidence integrity, acquisition, provenance, authenticity, and freshness remain distinct.","evidence":[{"evidence_id":"source:getting-started","sha256":"b1466d181438eea69b489cd6f48b0cc494d615e919f0d9deea4b0e588ffd61b6"}],"evidence_mode":"SOURCE","expected_value":{"integrity":"MATCHED","provenance_recorded":true},"fingerprint":"sha256:eafd8a05a5fddc4468914500740358e3c4ba88188d53ad67c7eb7e2de50a3d71","identity_status":"IDENTITY_UNVERIFIED","implementation_digest":"sha256:f06bdb2546c95d185d366f9804aa3b62ca917782f590a5f4d776f1242153a8be","likely_causes":[],"observed_value":{"acquisition":"COLLECTED","authenticity":"UNVERIFIED","deployment_trust":null,"freshness":"UNKNOWN","integrity":"MATCHED","provenance":"PRESENT"},"recommended_fix":"No remediation required.","regression_test_suggestion":"Keep asserted and attested provenance fixtures separate.","responsible_boundary":null,"rule_id":"DART-OPS-003","rule_version":"1.0.0","severity":"medium","status":"PASS","sub_identity":"source:getting-started","target":{"identity":"getting-started","kind":"DOCUMENT"},"title":"Evidence provenance and trust","validation_method":"Verify the bundle and inspect trust labels."}],"report_id":"sha256:c722c79e33829e29a842987dcaa66543a16e74b898b93732e872d7c45f8e91b8","schema_version":"1.0"}
